{
  "kind": "dataset_manifest",
  "schema_version": "benchmark_dataset_manifest_v1",
  "dataset_id": "large_prompts_v1",
  "source": {
    "source_type": "file",
    "format": "jsonl",
    "path": "./datasets/large_prompts.jsonl"
  },
  "canonicalization_version": "dataset_canonical_v1",
  "snapshot_policy": "compressed_blob",
  "dataset_hash": "sha256:eeeeeeeeeeeeeeeeeeeeeeeeeeeeeeeeeeeeeeeeeeeeeeeeeeeeeeeeeeeeeeee",
  "item_count": 2500,
  "item_hashes": null,
  "item_manifest_ref": null,
  "snapshot_blob_ref": {
    "type": "content_addressed_blob",
    "hash": "sha256:ffffffffffffffffffffffffffffffffffffffffffffffffffffffffffffffff",
    "uri": "datasets/blobs/sha256-ffff.jsonl.zst",
    "compression": "zstd",
    "media_type": "application/jsonl",
    "size_bytes": 123456,
    "uncompressed_size_bytes": 987654,
    "item_count": 2500
  }
}
